[
  {
    "id": "openai",
    "name": "OpenAI",
    "aliases": ["open-ai", "open_ai", "open ai", "openAI"],
    "website": "https://openai.com",
    "domains": ["openai.com", "api.openai.com"],
    "endpoints": [
      {
        "id": "openai-v1",
        "protocol": "openai-compatible",
        "baseUrl": "https://api.openai.com/v1",
        "source": "https://developers.openai.com/api/docs/api-reference/authentication",
        "lastVerified": "2026-05-07",
        "notes": "Official API reference shows curl requests to https://api.openai.com/v1/models and https://api.openai.com/v1/chat/completions."
      }
    ]
  },
  {
    "id": "anthropic",
    "name": "Anthropic",
    "aliases": ["claude", "anthropic-claude"],
    "website": "https://www.anthropic.com",
    "domains": ["anthropic.com", "api.anthropic.com"],
    "endpoints": [
      {
        "id": "anthropic-api",
        "protocol": "anthropic-compatible",
        "baseUrl": "https://api.anthropic.com",
        "source": "https://platform.claude.com/docs/en/api/getting-started",
        "lastVerified": "2026-05-07",
        "notes": "Official API overview states that the Claude API is a RESTful API at https://api.anthropic.com."
      }
    ]
  },
  {
    "id": "deepseek",
    "name": "DeepSeek",
    "aliases": ["deep-seek", "deep_seek"],
    "website": "https://www.deepseek.com",
    "domains": ["deepseek.com", "api.deepseek.com"],
    "endpoints": [
      {
        "id": "deepseek-openai",
        "protocol": "openai-compatible",
        "baseUrl": "https://api.deepseek.com",
        "source": "https://api-docs.deepseek.com/",
        "lastVerified": "2026-05-07",
        "notes": "Official docs list base_url=https://api.deepseek.com for OpenAI-compatible calls."
      }
    ]
  },
  {
    "id": "moonshot",
    "name": "Moonshot AI",
    "aliases": ["kimi", "moonshot-ai", "moonshotai"],
    "website": "https://www.moonshot.cn",
    "domains": ["moonshot.cn", "api.moonshot.cn"],
    "endpoints": [
      {
        "id": "moonshot-openai",
        "protocol": "openai-compatible",
        "baseUrl": "https://api.moonshot.cn/v1",
        "source": "https://platform.kimi.com/docs/guide/start-using-kimi-api",
        "lastVerified": "2026-05-07",
        "notes": "Official Kimi quickstart configures OpenAI(..., base_url=\"https://api.moonshot.cn/v1\")."
      }
    ]
  },
  {
    "id": "zhipu-ai",
    "name": "Zhipu AI",
    "aliases": ["zhipu", "bigmodel", "glm", "智谱", "智谱AI"],
    "website": "https://open.bigmodel.cn",
    "domains": ["bigmodel.cn", "open.bigmodel.cn"],
    "endpoints": [
      {
        "id": "zhipu-openai",
        "protocol": "openai-compatible",
        "baseUrl": "https://open.bigmodel.cn/api/paas/v4",
        "source": "https://docs.bigmodel.cn/cn/guide/start/quick-start",
        "lastVerified": "2026-05-07",
        "notes": "Official quickstart posts to https://open.bigmodel.cn/api/paas/v4/chat/completions and distinguishes a separate coding-only endpoint."
      }
    ]
  },
  {
    "id": "dashscope",
    "name": "Alibaba Cloud DashScope",
    "aliases": ["aliyun-dashscope", "qwen", "tongyi", "通义千问"],
    "website": "https://dashscope.aliyun.com",
    "domains": ["dashscope.aliyun.com", "dashscope.aliyuncs.com", "dashscope-us.aliyuncs.com", "dashscope-intl.aliyuncs.com"],
    "endpoints": [
      {
        "id": "dashscope-openai-compatible",
        "protocol": "openai-compatible",
        "baseUrl": "https://dashscope.aliyuncs.com/compatible-mode/v1",
        "source": "https://help.aliyun.com/zh/model-studio/compatibility-of-openai-with-dashscope",
        "lastVerified": "2026-05-07",
        "notes": "Official compatibility docs list the Beijing region BASE_URL as https://dashscope.aliyuncs.com/compatible-mode/v1."
      },
      {
        "id": "dashscope-openai-compatible-us",
        "protocol": "openai-compatible",
        "baseUrl": "https://dashscope-us.aliyuncs.com/compatible-mode/v1",
        "source": "https://help.aliyun.com/zh/model-studio/compatibility-of-openai-with-dashscope",
        "lastVerified": "2026-05-07",
        "notes": "Official compatibility docs list the US region BASE_URL as https://dashscope-us.aliyuncs.com/compatible-mode/v1."
      },
      {
        "id": "dashscope-openai-compatible-intl",
        "protocol": "openai-compatible",
        "baseUrl": "https://dashscope-intl.aliyuncs.com/compatible-mode/v1",
        "source": "https://help.aliyun.com/zh/model-studio/compatibility-of-openai-with-dashscope",
        "lastVerified": "2026-05-07",
        "notes": "Official compatibility docs list the Singapore region BASE_URL as https://dashscope-intl.aliyuncs.com/compatible-mode/v1."
      }
    ]
  },
  {
    "id": "siliconflow",
    "name": "SiliconFlow",
    "aliases": ["silicon-flow", "硅基流动"],
    "website": "https://siliconflow.cn",
    "domains": ["siliconflow.cn", "api.siliconflow.cn"],
    "endpoints": [
      {
        "id": "siliconflow-openai",
        "protocol": "openai-compatible",
        "baseUrl": "https://api.siliconflow.cn/v1",
        "source": "https://docs.siliconflow.cn/cn/userguide/quickstart",
        "lastVerified": "2026-05-07",
        "notes": "Official quickstart shows base_url=\"https://api.siliconflow.cn/v1\" in the OpenAI client example."
      }
    ]
  },
  {
    "id": "openrouter",
    "name": "OpenRouter",
    "aliases": ["open-router", "open_router"],
    "website": "https://openrouter.ai",
    "domains": ["openrouter.ai"],
    "endpoints": [
      {
        "id": "openrouter-openai",
        "protocol": "openai-compatible",
        "baseUrl": "https://openrouter.ai/api/v1",
        "source": "https://openrouter.ai/docs/quickstart",
        "lastVerified": "2026-05-07",
        "notes": "Official quickstart sets baseURL to https://openrouter.ai/api/v1 and sends requests to /chat/completions there."
      }
    ]
  },
  {
    "id": "groq",
    "name": "Groq",
    "aliases": [],
    "website": "https://groq.com",
    "domains": ["groq.com", "api.groq.com"],
    "endpoints": [
      {
        "id": "groq-openai",
        "protocol": "openai-compatible",
        "baseUrl": "https://api.groq.com/openai/v1",
        "source": "https://console.groq.com/docs/openai",
        "lastVerified": "2026-05-07",
        "notes": "Official OpenAI-compatibility docs set base_url=\"https://api.groq.com/openai/v1\"."
      }
    ]
  },
  {
    "id": "together-ai",
    "name": "Together AI",
    "aliases": ["together", "togetherai"],
    "website": "https://www.together.ai",
    "domains": ["together.ai", "api.together.ai"],
    "endpoints": [
      {
        "id": "together-openai",
        "protocol": "openai-compatible",
        "baseUrl": "https://api.together.ai/v1",
        "source": "https://docs.together.ai/reference/chat-completions.md",
        "lastVerified": "2026-05-07",
        "notes": "Official chat completions OpenAPI defines server https://api.together.ai/v1 and the cURL sample posts to https://api.together.ai/v1/chat/completions."
      }
    ]
  },
  {
    "id": "minimax",
    "name": "MiniMax",
    "aliases": ["mini-max", "minimax-ai", "minimaxi"],
    "website": "https://www.minimax.io",
    "domains": ["minimaxi.com", "minimax.io", "api.minimaxi.com", "api.minimax.io"],
    "endpoints": [
      {
        "id": "minimax-openai-cn",
        "protocol": "openai-compatible",
        "baseUrl": "https://api.minimaxi.com/v1",
        "source": "https://platform.minimaxi.com/docs/api-reference/text-chat",
        "lastVerified": "2026-05-07",
        "notes": "Official China mainland OpenAI-compatible docs send POST requests to https://api.minimaxi.com/v1/chat/completions."
      },
      {
        "id": "minimax-openai-global",
        "protocol": "openai-compatible",
        "baseUrl": "https://api.minimax.io/v1",
        "source": "https://platform.minimax.io/docs/guides/text-generation",
        "lastVerified": "2026-05-07",
        "notes": "Official global text-generation docs list base_url (OpenAI-compatible) as https://api.minimax.io/v1 and show curl to /v1/chat/completions."
      }
    ]
  }
]
