[
  {
    "id": "openai",
    "name": "OpenAI",
    "aliases": [
      "open-ai",
      "open_ai",
      "open ai",
      "openAI"
    ],
    "website": "https://openai.com",
    "domains": [
      "openai.com",
      "api.openai.com"
    ],
    "endpoints": [
      {
        "id": "openai-v1",
        "protocol": "openai-compatible",
        "baseUrl": "https://api.openai.com/v1",
        "source": "https://platform.openai.com/docs/api-reference",
        "lastVerified": "2026-05-07",
        "notes": "Official OpenAI API endpoint."
      }
    ]
  },
  {
    "id": "anthropic",
    "name": "Anthropic",
    "aliases": [
      "claude",
      "anthropic-claude"
    ],
    "website": "https://www.anthropic.com",
    "domains": [
      "anthropic.com",
      "api.anthropic.com"
    ],
    "endpoints": [
      {
        "id": "anthropic-api",
        "protocol": "anthropic-compatible",
        "baseUrl": "https://api.anthropic.com",
        "source": "https://docs.anthropic.com/en/api/messages",
        "lastVerified": "2026-05-07",
        "notes": "Official Anthropic Messages API endpoint."
      }
    ]
  },
  {
    "id": "deepseek",
    "name": "DeepSeek",
    "aliases": [
      "deep-seek",
      "deep_seek"
    ],
    "website": "https://www.deepseek.com",
    "domains": [
      "deepseek.com",
      "api.deepseek.com"
    ],
    "endpoints": [
      {
        "id": "deepseek-openai",
        "protocol": "openai-compatible",
        "baseUrl": "https://api.deepseek.com",
        "source": "https://api-docs.deepseek.com/",
        "lastVerified": "2026-05-07",
        "notes": "OpenAI-compatible API endpoint."
      }
    ]
  },
  {
    "id": "moonshot",
    "name": "Moonshot AI",
    "aliases": [
      "kimi",
      "moonshot-ai",
      "moonshotai"
    ],
    "website": "https://www.moonshot.cn",
    "domains": [
      "moonshot.cn",
      "api.moonshot.cn"
    ],
    "endpoints": [
      {
        "id": "moonshot-openai",
        "protocol": "openai-compatible",
        "baseUrl": "https://api.moonshot.cn/v1",
        "source": "https://platform.moonshot.cn/docs",
        "lastVerified": "2026-05-07",
        "notes": "OpenAI-compatible API endpoint for Moonshot/Kimi."
      }
    ]
  },
  {
    "id": "zhipu-ai",
    "name": "Zhipu AI",
    "aliases": [
      "zhipu",
      "bigmodel",
      "glm",
      "智谱",
      "智谱AI"
    ],
    "website": "https://open.bigmodel.cn",
    "domains": [
      "bigmodel.cn",
      "open.bigmodel.cn"
    ],
    "endpoints": [
      {
        "id": "zhipu-openai",
        "protocol": "openai-compatible",
        "baseUrl": "https://open.bigmodel.cn/api/paas/v4",
        "source": "https://docs.bigmodel.cn/",
        "lastVerified": "2026-05-07",
        "notes": "OpenAI-compatible API endpoint."
      }
    ]
  },
  {
    "id": "dashscope",
    "name": "Alibaba Cloud DashScope",
    "aliases": [
      "aliyun-dashscope",
      "qwen",
      "tongyi",
      "通义千问"
    ],
    "website": "https://dashscope.aliyun.com",
    "domains": [
      "dashscope.aliyun.com",
      "dashscope.aliyuncs.com"
    ],
    "endpoints": [
      {
        "id": "dashscope-openai-compatible",
        "protocol": "openai-compatible",
        "baseUrl": "https://dashscope.aliyuncs.com/compatible-mode/v1",
        "source": "https://help.aliyun.com/zh/model-studio/compatibility-of-openai-with-dashscope",
        "lastVerified": "2026-05-07",
        "notes": "OpenAI-compatible mode endpoint for DashScope."
      }
    ]
  },
  {
    "id": "siliconflow",
    "name": "SiliconFlow",
    "aliases": [
      "silicon-flow",
      "硅基流动"
    ],
    "website": "https://siliconflow.cn",
    "domains": [
      "siliconflow.cn",
      "api.siliconflow.cn"
    ],
    "endpoints": [
      {
        "id": "siliconflow-openai",
        "protocol": "openai-compatible",
        "baseUrl": "https://api.siliconflow.cn/v1",
        "source": "https://docs.siliconflow.cn/",
        "lastVerified": "2026-05-07",
        "notes": "OpenAI-compatible API endpoint."
      }
    ]
  },
  {
    "id": "openrouter",
    "name": "OpenRouter",
    "aliases": [
      "open-router",
      "open_router"
    ],
    "website": "https://openrouter.ai",
    "domains": [
      "openrouter.ai"
    ],
    "endpoints": [
      {
        "id": "openrouter-openai",
        "protocol": "openai-compatible",
        "baseUrl": "https://openrouter.ai/api/v1",
        "source": "https://openrouter.ai/docs",
        "lastVerified": "2026-05-07",
        "notes": "OpenAI-compatible aggregator endpoint."
      }
    ]
  },
  {
    "id": "groq",
    "name": "Groq",
    "aliases": [],
    "website": "https://groq.com",
    "domains": [
      "groq.com",
      "api.groq.com"
    ],
    "endpoints": [
      {
        "id": "groq-openai",
        "protocol": "openai-compatible",
        "baseUrl": "https://api.groq.com/openai/v1",
        "source": "https://console.groq.com/docs/openai",
        "lastVerified": "2026-05-07",
        "notes": "OpenAI-compatible API endpoint."
      }
    ]
  },
  {
    "id": "together-ai",
    "name": "Together AI",
    "aliases": [
      "together",
      "togetherai"
    ],
    "website": "https://www.together.ai",
    "domains": [
      "together.ai",
      "api.together.xyz"
    ],
    "endpoints": [
      {
        "id": "together-openai",
        "protocol": "openai-compatible",
        "baseUrl": "https://api.together.xyz/v1",
        "source": "https://docs.together.ai/docs/openai-api-compatibility",
        "lastVerified": "2026-05-07",
        "notes": "OpenAI-compatible API endpoint."
      }
    ]
  }
]
